{
  "$schema": "https://json-schema.org/draft/2020-12/schema",
  "$id": "https://example.com/quiz-studio/schemas/quiz-paper.schema.json",
  "title": "Quiz Studio Paper",
  "type": "object",
  "required": ["schemaVersion", "id", "title", "questions"],
  "additionalProperties": true,
  "properties": {
    "schemaVersion": {
      "type": "integer",
      "minimum": 1
    },
    "id": {
      "type": "string",
      "minLength": 1
    },
    "title": {
      "type": "string"
    },
    "description": {
      "type": "string"
    },
    "category": {
      "type": "string"
    },
    "tags": {
      "type": "array",
      "items": {
        "type": "string"
      }
    },
    "createdAt": {
      "type": "string"
    },
    "updatedAt": {
      "type": "string"
    },
    "lastOpenedAt": {
      "type": "string"
    },
    "provenance": {
      "$ref": "#/$defs/provenance"
    },
    "questions": {
      "type": "array",
      "items": {
        "$ref": "#/$defs/question"
      }
    }
  },
  "$defs": {
    "actor": {
      "type": "object",
      "required": ["type"],
      "additionalProperties": false,
      "properties": {
        "type": {
          "enum": ["anonymous", "human", "external-ai", "agent", "system"]
        },
        "displayLabel": { "type": "string" },
        "toolName": { "type": "string" }
      }
    },
    "provenance": {
      "type": "object",
      "additionalProperties": false,
      "properties": {
        "purpose": { "type": "string" },
        "sourceResponseId": { "type": "string" },
        "sourceReviewId": { "type": "string" },
        "sourceMaterialId": { "type": "string" },
        "createdAt": { "type": "string" },
        "author": { "$ref": "#/$defs/actor" },
        "extensions": { "type": "object" }
      }
    },
    "question": {
      "type": "object",
      "required": ["id", "type", "prompt"],
      "oneOf": [
        { "$ref": "#/$defs/singleChoice" },
        { "$ref": "#/$defs/multipleChoice" },
        { "$ref": "#/$defs/blank" },
        { "$ref": "#/$defs/trueFalse" },
        { "$ref": "#/$defs/matching" }
      ]
    },
    "baseQuestion": {
      "type": "object",
      "required": ["id", "type", "prompt"],
      "properties": {
        "id": { "type": "string", "minLength": 1 },
        "type": { "type": "string" },
        "prompt": { "type": "string" },
        "image": { "$ref": "#/$defs/imageMedia" },
        "audio": { "$ref": "#/$defs/audioMedia" }
      }
    },
    "imageMedia": {
      "type": "object",
      "required": ["id", "mimeType", "name", "size"],
      "properties": {
        "id": { "type": "string", "minLength": 1 },
        "mimeType": { "type": "string" },
        "name": { "type": "string" },
        "size": { "type": "integer", "minimum": 0 },
        "alt": { "type": "string" }
      }
    },
    "audioMedia": {
      "type": "object",
      "required": ["id", "mimeType", "name", "size"],
      "properties": {
        "id": { "type": "string", "minLength": 1 },
        "mimeType": { "type": "string" },
        "name": { "type": "string" },
        "size": { "type": "integer", "minimum": 0 },
        "duration": { "type": "number", "minimum": 0 }
      }
    },
    "option": {
      "type": "object",
      "required": ["id", "text", "correct"],
      "properties": {
        "id": { "type": "string", "minLength": 1 },
        "text": { "type": "string" },
        "correct": { "type": "boolean" }
      }
    },
    "singleChoice": {
      "allOf": [
        { "$ref": "#/$defs/baseQuestion" },
        {
          "type": "object",
          "properties": {
            "type": { "const": "single" },
            "options": {
              "type": "array",
              "minItems": 2,
              "items": { "$ref": "#/$defs/option" }
            }
          },
          "required": ["options"]
        }
      ]
    },
    "multipleChoice": {
      "allOf": [
        { "$ref": "#/$defs/baseQuestion" },
        {
          "type": "object",
          "properties": {
            "type": { "const": "multiple" },
            "options": {
              "type": "array",
              "minItems": 2,
              "items": { "$ref": "#/$defs/option" }
            }
          },
          "required": ["options"]
        }
      ]
    },
    "blank": {
      "allOf": [
        { "$ref": "#/$defs/baseQuestion" },
        {
          "type": "object",
          "properties": {
            "type": { "const": "blank" },
            "answers": {
              "type": "array",
              "items": { "type": "string" }
            },
            "caseSensitive": { "type": "boolean" }
          },
          "required": ["answers"]
        }
      ]
    },
    "trueFalse": {
      "allOf": [
        { "$ref": "#/$defs/baseQuestion" },
        {
          "type": "object",
          "properties": {
            "type": { "const": "truefalse" },
            "answer": { "type": "boolean" }
          },
          "required": ["answer"]
        }
      ]
    },
    "matching": {
      "allOf": [
        { "$ref": "#/$defs/baseQuestion" },
        {
          "type": "object",
          "properties": {
            "type": { "const": "matching" },
            "pairs": {
              "type": "array",
              "minItems": 2,
              "items": {
                "type": "object",
                "required": ["id", "left", "right"],
                "properties": {
                  "id": { "type": "string", "minLength": 1 },
                  "left": { "type": "string" },
                  "right": { "type": "string" }
                }
              }
            }
          },
          "required": ["pairs"]
        }
      ]
    }
  }
}
